{
  "$schema": "https://json-schema.org/draft/2020-12/schema",
  "$id": "https://getmaipai.github.io/shared/spec/schemas/stack-setting.schema.json",
  "title": "StackSetting",
  "description": "One declared Stack setting as GET /stack/v1/settings serves it: a SettingsKey (spec/schemas/settings-key.schema.json, the same fields and constraints, restricted to scope `device` and lives_in `stack`) plus the Stack's three fields: whether the key takes effect only after a restart, the value in effect, and the pending value. Home's generic settings renderer draws the control from the SettingsKey half and reads and writes the value half; the Stack declares each key exactly once.",
  "type": "object",
  "additionalProperties": false,
  "required": ["key", "scope", "selector", "default", "label", "level", "lives_in", "honoured_by", "needs_restart", "in_effect", "pending"],
  "properties": {
    "key": { "type": "string", "pattern": "^stack(\\.[a-z][a-z0-9_]*)+$" },
    "scope": { "type": "string", "const": "device" },
    "selector": { "type": "string", "enum": ["number", "select", "text", "boolean"] },
    "range": { "description": "Selector-specific: {min, max} for number, {options: [{value, label}]} for select." },
    "default": {},
    "label": { "type": "string", "minLength": 1 },
    "help": { "type": "string" },
    "section": {
      "type": "object",
      "additionalProperties": false,
      "properties": { "id": { "type": "string" }, "collapsed": { "type": "boolean", "default": false }, "order": { "type": "integer" } }
    },
    "level": { "type": "string", "enum": ["basic", "advanced", "expert"] },
    "secret": { "type": "boolean", "default": false },
    "needs": { "type": "array", "items": { "type": "string" } },
    "lives_in": { "type": "string", "const": "stack" },
    "honoured_by": { "type": "array", "items": { "type": "string", "enum": ["home", "bot"] }, "minItems": 1 },
    "needs_restart": { "type": "boolean", "description": "True when a change is held as `pending` until the service restarts." },
    "in_effect": { "description": "The value the daemon is running with. Shape depends on the selector." },
    "pending": { "description": "A stored value not yet in effect, or null." }
  }
}
