{
  "key": "stack.memory.model_budget_bytes",
  "scope": "device",
  "selector": "number",
  "range": {
    "min": 0,
    "max": 68719476736
  },
  "default": 60129542144,
  "label": "Memory for models",
  "help": "The maximum memory the Stack may use for loaded models.",
  "section": {
    "id": "memory",
    "order": 10
  },
  "level": "basic",
  "secret": false,
  "lives_in": "stack",
  "honoured_by": [
    "home",
    "bot"
  ],
  "needs_restart": false,
  "in_effect": 60129542144,
  "pending": null
}
