{
  "key": "stack.engines.llama_server.context_length",
  "scope": "device",
  "selector": "number",
  "range": {
    "min": 512,
    "max": 262144
  },
  "default": 4096,
  "label": "Context length",
  "section": {
    "id": "engines.llama_server",
    "order": 10
  },
  "level": "advanced",
  "lives_in": "stack",
  "honoured_by": [
    "home",
    "bot"
  ],
  "needs_restart": true,
  "in_effect": 4096,
  "pending": 8192
}
